id,id_str,screen_name,location,age,in_out_ratio,favorites_ratio,status_ratio,account_rep,avg_tpd,hashtags_ratio,user_mentions_ratio,mal_url_ratio,cce,spam_ratio,description,bot
2570899740,2570899740,businessman_exe,working late,133932940.61838388,1,0.0012901979095072684,11.613716482429677,1.0,10.526315789473685,0.0,0.0,0.0,6.932795069256772,0.216,Finally  more businessmen     bot by  ckolderup  botALLY,1
2474042306,2474042306,supervocalic,,137819098.4251089,6.461538461538462,0.9817391170464195,0.07334832483680145,0.865979381443299,2.0625,0.020202020202020204,0.7575757575757576,0.0,21.123501111265796,0.061855670103092786,Sundry all vowel chirps  A  E  I  O   U   w  no duplicates  A dumb Twitter bot  Built by  santheo    pzlr ,1
2372286949,2372286949,BioinformaticsP,,142894257.7566781,11.222222222222221,0.0006046429111736797,2.9415877628599514,0.9181818181818182,7.352941176470588,0.0,0.001,0.0,170.37476940440956,0.033,New papers from  Oxford Bioinformatics  Briefings in Bioinformatics  BMC Bioinformatics  SCFBM  PLOS CB  ACM IEEE  Generated with twitterfeed,1
3180272609,3180272609,AvengerEngineer,,107475240.87773299,1.7812775978804827,0.07074373537482577,0.7202998510891351,0.6404530059271804,1.1563307493540051,2.0268156424581005,0.15083798882681565,0.0,112.9133960876745,0.07574094401756312,Bridging the gap between telecommunications construction   engineering ,1
2277757998,2277757998,flippedconcept,,147917458.5821221,9.933333333333334,0.0023364381954150922,2.9439121262230166,0.9085365853658537,3.717472118959108,0.0,0.02,0.0,145.83083644744025,0.702,everything is flipped   by  negatendo    botALLY,1
2720832374,2720832374,rulesofcards,,129212018.33365107,62.0,0.0,4.197900528102316,0.9841269841269841,5.9880239520958085,0.0,0.0,0.0,0.2713710656112089,0.249,A bot that generates rules for impossible card games  By  atduskgreg ,1
3052517302,3052517302,TransxnNoiseBot,,112249127.03806901,1,0.0,0.3202020447589782,1.0,3.8878504672897196,0.0,0.0,0.0,117.93845997864723,0.09134615384615384,Scholar alerts on transcriptional noise  made by  biochemistries,1
3317221923,3317221923,future_junk,In a rusty cargo container.,102917449.546139,29.066666666666666,0.08982733288445373,2.330473608291996,0.9667405764966741,2.0964360587002098,0.0,0.049,0.0,88.76376640999771,0.034,A bot that generates random malfunctioning equipment  created by  notinventedhere using http   t co XpDujaprri,1
177502839,177502839,metagenomics,,255254360.52027798,5.757068667051356,25.380349181088086,6.875325445657107,0.8520068317677199,8.771929824561404,0.132,0.26,0.0,201.00359968344245,0.024,Automated newsfeed dedicated to scientific information on the human microbiome  Share   RT of articles   endorsement  For mainstream info check  microbiome,1
3003428519,3003428519,sRNAPapers,,114392409.68124604,22.0,0.0015105897365175404,5.299148795703532,0.9565217391304348,7.352941176470588,0.0,0.0,0.0,208.98439434892157,0.074, ,1
2617339802,2617339802,winter_py,,131773409.45825505,1,0.0,3.2960579967204517,1.0,10.416666666666666,0.0,0.0,0.0,1.2999942762061787,1.0,moody winter scenes in your timeline    by  dbaker h    avatar from http   t co rfqEslGQrt,1
2901778089,2901778089,BMPBug,,119362565.85489392,4.853658536585366,0.0,83.49986722065223,0.8291666666666667,111.11111111111111,0.287,0.71,0.0,93.67259143790513,0.149,My BMP converter has a bizare bug  send me pictures and you ll see  I am a strong believer in the full potential of other bots  See terms in link ,1
2795689592,2795689592,NeuroGen_papers,"London, UK",126772634.08045602,1,0.0,21.03762550447123,1.0,9.523809523809524,0.0,0.0,0.0,195.1946426733469,0.032,Twitterbot from  TheGBLab  Follow me to stay up to date with research in  Alzheimer s   Parkinson s    Neurogenetics in general  Also on http   t co  j Cwnqq i,1
2669568144,2669568144,pooledseq,,130818858.76487899,1,0.0,10.744946204785066,1.0,9.900990099009901,0.0,0.0,0.0,200.08004426128684,0.059,A feed for papers related to pooled   population   or evolved and re  sequencing published in NCBI  ArXiv  and bioArxiv ,1
68956490,68956490,RedScareBot,Wisconsin,285572283.351753,89.61486486486487,0.8625711049716545,755.6310460781116,0.9889642830512266,90.9090909090909,0.222,1.476,0.0,6.28139077617389,0.022,Joseph McCarthy claimed there were large numbers of Communists and Soviet spies and sympathizers inside the United States federal government and elsewhere ,1
3312790286,3312790286,AnimalVidBot,,97527191.33422899,1,0.0,0.7787120592833628,1.0,3.8552631578947367,0.0,0.0,0.0,50.43837861979853,0.21843003412969283,Animal videos sourced from  macaulaylibrary  Turn up the sound     A bot by  tinysubversions  Not affiliated with the Macaulay Library ,1
4790723008,4790723008,classifybot,,84197392.74737,7.2727272727272725,0.0020523200821488336,11.41705661699396,0.8791208791208791,11.235955056179776,0.0,0.0,0.0,41.54829616594618,0.18,I m just a little bot  organizing NYPL public domain collections  trying to make some sense out of this big world  Built with data from https   t co jvMfPJ cFp,1
3266483216,3266483216,fontcriticbot,The Font of All Knowledge,100986732.80131793,12.0,0.0,0.6733240903414256,0.9230769230769231,2.0025445292620865,0.0,0.0,0.0,45.73902134578764,0.1423125794155019,Criticises fonts from http   t co wWmvMyo Zf for the more discerning of authors  A bot created by  eegnsma,1
239223019,239223019,QIMRBergh_pubs,"Brisbane, Australia",241620596.7881379,33.666666666666664,0.0,0.607895195825503,0.9711538461538461,1.890359168241966,0.0,0.0,0.0,7.174860315189089,0.036,Official feed of scientific publications by QIMR Berghofer researchers from PubMed   This is an automated feed  Please direct any tweets at  QIMRBerghofer,1
2789910212,2789910212,TC_papers,,127018009.52999711,1,0.0,11.503855283253495,1.0,8.333333333333334,0.0,0.0,0.0,139.48833973363278,0.059,Pubmed twitterbot  arealization OR patterning OR somatosensory OR thalamus OR thalamocortical OR cortical development,1
129845242,129845242,Inspire_Us,,266376970.09507895,24.3267499623664,1.3629286340722855,27.2650597287283,0.9605160551004008,23.25581395348837,0.017,0.182,0.0,243.76889900511372,0.418,The BEST Inspirational Quotes out there ,1
42805105,42805105,swear_bot,Everywhere,293464931.68473005,324.0,0.0,93.70559351719257,0.9969230769230769,18.867924528301888,0.0,0.66,0.0,3.801322596786404,0.05,I m a robot tracking data for bad words  Don t mind me ,1
3350730149,3350730149,GIFsofWikipedia,,101275044.18190694,250.3448275862069,1.0732278704788556,4.887537734478031,0.9960214021127727,13.157894736842104,0.0,0.03,0.0,42.403215808249925,0.979,sporadically tweeting animated GIFs from Wikipedia  not affiliated with Wikipedia  DMs are open ,1
3242711672,3242711672,RoboRosewater,,102797215.83404589,6010.75,0.03866252570902509,0.7606431688406022,0.9998336590842932,1.0838323353293413,0.004419889502762431,0.039779005524861875,0.0,21.591221402244482,0.48355263157894735,Magic cards generated by a Recurrent Neural Network  posted once a day  Not Mark Rosewater ,1
3238422218,3238422218,Slam140,Internets,103214332.89526391,0.7778207109737248,16.458086317563623,15.055118377568881,0.4375135840034775,111.11111111111111,0.0,0.73,0.0,22.523798445730332,0.347,bot that congratulates you for making a     character tweet  aka the slam dunk of tweeting   by  logoninternet,1
1914615907,1914615907,ColorADayBot,,156475640.30493093,1,0.0005521626230870731,0.3456538020525078,1.0,1.0016,0.0,0.0,0.0,56.10834689462105,0.004792332268370607,What will today s color be ,1
4307950162,4307950162,Indie_Dev_Bot,,88136494.32417393,728.8571428571429,54.50455043436429,54.51043222038239,0.9986298688588765,90.9090909090909,5.246,1.068,0.0,1.2991465532855846,0.0,A bot that retweets anything related to  indiedev  Unity D,1
2374920458,2374920458,aDNA_papers,Japan,142770112.89166093,1,0.0,6.173325650227736,1.0,8.333333333333334,0.0,0.0,0.0,227.0349583643872,0.074,TwitterBot for papers in ancient DNA and human genomics from arXiv  bioRxiv    Pubmed  Curated by  bigskybioarch,1
2361501445,2361501445,CointraqBot,,143503750.00428605,3.2857142857142856,0.0,3.820164978153021,0.7666666666666667,16.666666666666668,1.974,0.0,0.0,6.026246920521823,0.0,Every hour  Cointraq Price Bot tweets the price of a randomly chosen coin worth at least      ,1
1850074248,1850074248,LifehackLifehax,In your brain.,158080681.893013,1,0.0,6.324750045528435,1.0,40.0,1.164,0.0,0.0,35.976241625058954,0.182,I am a bot that generates lifehackish tweets  built by  mitchc ,1
3038750682,3038750682,DifferenceJoke,funny town LOL,112108103.97484994,1,0.0,0.06242546035360659,1.0,16.2,0.0,0.0,0.0,11.282727523733607,0.012345679012345678,THE DIFFERENCE IS THAT THEY RHYME HA HA    see also   badjokebot   HinkyPinkyQs    by  thricedotted,1
2946240832,2946240832,acrotowne,,117066898.475739,0.9619377162629758,0.0007380395408519819,8.564210832046399,0.49029982363315694,4.854368932038835,0.084,0.419,0.0,163.1403867135712,0.021,By  zhaytee    Learn how to play here  https   t co a  R wz tO,1
1937939858,1937939858,AddAWordBot,(Bot by @robdubbin),155875245.26634192,1,0.0,379.5873751402923,1.0,500.0,1.0,0.0,0.0,228.59589930049836,0.017,Let s keep this thing going  gang   AddaWordRuinaMovie,1
4765790730,4765790730,GraphicScoreBot,deerful.space,83948340.8906579,756.0,0.0,23.458655395763195,0.9986789960369881,23.25581395348837,0.0,0.0,0.0,86.22076460573153,0.928,Hourly graphic scores for musicians  composers  and anyone else  How to use more information  https   t co XkCKvJXsDo   By  deer ful ,1
386263630,386263630,johnhall,"Missouri, USA",218918428.82906795,1.1043485161085542,0.5837133067484936,1.3627870508468887,0.5247935442512915,2.898550724637681,1.045,1.188,0.0,201.57867250931864,0.347,Co founder  influenceandco  Author https   t co  mVXaATltI  Book me to speak at https   t co tml NNq Dt   most important father husband,1
3169494832,3169494832,OMG_wikipedia,,107771687.24284005,1,0.0,22.004116857301483,1.0,22.727272727272727,0.0,0.0,0.0,28.128440030246505,0.087,Explaining the world  wrongly  One tweet per hour  Made by  ojahnn ,1
575930104,575930104,metaphorminute,,200238858.62315798,929.0,1.0467818356599374,693.1961046643071,0.9989247311827957,500.0,0.0,0.0,0.0,32.32203832217344,0.139,Uh  blame  tinysubversions for this one   Actually one metaphor every two minutes  Twitter rate limits  ,1
2244682986,2244682986,aportraitofthe,,149880938.87895393,1,0.0005764575578871836,4.978863927471604,1.0,25.0,0.0,0.0,0.0,14.746259001569028,0.079,Fake James Joyce novel titles  A bot by  sillygwailo   botALLY,1
2553099692,2553099692,JEveryword,¾Ñ´¾ÏÂ,134697008.8440199,235.0,0.0,46.605720898149755,0.9957627118644068,45.45454545454545,0.0,0.0,0.0,3.4282108239743447,1.0,In loving memory   taskcomplete  botALLY  thankUbasedJEDict  by  BooDooPerson ,1
2288902454,2288902454,PedanticMagick,The aether,147284532.43748498,1,0.0,18.298426558429863,1.0,11.363636363636363,0.0,0.0,0.0,24.799311882767384,0.253,What if your spellbook was ridiculously precise  A project of  muffinista  botALLY,1
2900522030,2900522030,blahfuture,,120797073.88309503,1,0.0,7.595945584642256,1.0,6.622516556291391,0.0,0.0,0.0,88.38127403980964,0.061,a little disappointed tbh,1
2614979671,2614979671,mnemosynetron,,131889015.06847692,3.269230769230769,0.08254212827617045,0.1382253100497775,0.7657657657657657,5.410256410256411,0.0,0.9241706161137441,0.0,45.128961052318814,0.0947867298578199, WORK IN PROGRESS  reminder bot  try   mnemosynetron remind me to X at in on Y     more notes in link    by and for  thricedotted,1
2961844870,2961844870,cyclicdigmp,,116408522.03151393,16.0,0.0,0.2850100612996204,0.9411764705882353,1.292929292929293,0.8776041666666666,0.0,0.0,160.21733351486972,0.12176165803108809,Keep up to date on the latest publications on the universal second messenger Cyclic di GMP with this twitter feed of up to date publications ,1
2620118677,2620118677,yes_ofc,yeah,131734226.79958296,1,0.5765062113701223,0.30628942060278397,1.0,8.339285714285714,0.0,1.4775160599571735,0.0,26.76405496531356,0.1905781584582441,of course    by  thricedotted,1
3302130449,3302130449,justdidathing,,104019406.66897392,95.0,0.0,23.452392953589456,0.9895833333333334,23.80952380952381,0.012,0.0,0.0,2.8722102700673338,0.036,In case you were wondering  Bot by  RobertVinluan   botAlly,1
2938368655,2938368655,realdinogenera,the Jurassic period,117687115.76340008,1,0.0,11.982062699496817,1.0,11.904761904761905,0.0,0.0,0.0,3.4299876502769453,0.998,totally legit scientific names for extinct beasts    by  dbaker h,1
4888553495,"""4888553495""","""letsgovelo""","""Worcester, England""",81918153.46192503,0.6519721577726219,0.1961762969604705,0.28055319887895247,0.3946629213483146,2.180327868852459,1.4248120300751879,0.8157894736842105,0.0,96.05428133948215,0.08646616541353383,We are a specialist  cycling events and holiday company creating bespoke experiences for all cyclists   CyclingHolidays  LoveCycling,1
2981339967,2981339967,HottestStartups,Frankfurt School,115488168.165802,1639.0,0.0007481285864363073,3.9448820362786488,0.999390243902439,3.9682539682539684,0.0,0.0,0.0,9.437096912071611,0.087,We love  innovation and are always thinking of the next  disruptive startup  idea     a bot by  tinysubversions,1
4872824255,4872824255,foodie_dems,all over this great country,82459533.01999402,1,0.0,1.9478354305142007,1.0,21.73913043478261,0.0,0.0,0.0,3.8055667793773056,1.0,bot by  ckolderup   botALLY  originals by https   t co  hvCgSnJWA,1
2553308112,2553308112,theveryword,#botALLY,134741726.69941807,1,0.0,25.75551378929292,1.0,45.45454545454545,0.0,0.0,0.0,8.497095860517708,0.034,Look around you  Look around you  Just look around you  Have you worked out what we re looking for  Correct  The answer is  Task will complete in     ,1
4730417298,4730417298,NerdGarbageBot,,84620142.38376403,5156.0,0.011231368480684005,24.281197621740574,0.9998060888113244,23.25581395348837,0.0,0.0,0.0,86.22076460573153,0.143,elevator pitches for nerd garbage  by  NoraReed  NOTE  this bot has a bug where sometimes it comes up with good ideas  sorry  I m working on it,1
2503370119,2503370119,apparent_things,dwelling is a gathering-forth,136530410.70493007,133.0,0.0,0.11264303623342621,0.9925373134328358,3.4901960784313726,0.06179775280898876,0.0,0.0,78.77579743573662,0.17415730337078653,Ever wondered what a thing is  Follow this ontography machine  powered by tweets proclaiming that something  is apparently a thing   By  staeiou,1
1902490670,1902490670,Unicode_ebooks,,156844082.413018,1,0.0,72.18927629149903,1.0,66.66666666666667,0.005,0.0,0.0,3.4299876502769453,0.953,For those especially zealous hunters of serendipity  here s     random Unicode characters every twenty minutes  By  aparrish ,1
3312793087,3312793087,GenreMasher,,97590916.50656891,1.1832669322709164,0.0017706565957741438,142.1128983768328,0.541970802919708,125.0,0.0,0.0,0.0,60.30923889801467,0.144,A bot that creates new musical subgenres,1
3381047014,3381047014,auto_automata,@nossidge,99744228.38920307,106.0,0.0,2.1300239966866865,0.9906542056074766,5.9523809523809526,0.0,0.0,0.0,12.443705064498634,1.0,Exploration of cellular automata  lo fi colour  and symmetry  A new image every four hours  Hosted by https   t co QD  bJ eLt ,1
2862814830,2862814830,VerifiedBioBot,,123273664.65637493,93.5,0.0,5.9350486743412025,0.9894179894179894,23.25581395348837,0.0,0.001,0.0,41.54829616594617,0.059,Tweeting the descriptions of verified users with no additional context  A bot by  gangles  not affiliated with Twitter ,1
2824166663,2824166663,ImportantAnimal,(bot by @hoffm),123837895.80483198,106.0,0.0,3.250520346650573,0.9906542056074766,11.235955056179776,0.0,0.0,0.0,235.71053718358556,0.043,Showcasing some of the most important animals around ,1
2230101666,2230101666,AU_Prompts,An Alternate Universe,150744021.9307871,388.0,0.00057315705719773,2.791274868552945,0.9974293059125964,2.293577981651376,0.0,0.0,0.0,82.04204334404783,0.257,Illuminated alternate universe romances of fictional characters  Tweets every six hours  By  tinysubversions ,1
3193947078,3193947078,man_products,#masculinitysofragile,105419573.420151,2995.0,0.0032783285758765783,7.9237201678936895,0.9996662216288384,7.936507936507937,0.0,0.0,0.0,10.052586139037306,0.098,PRODUCTS FOR MEN   A bot by  NoraReed  Thanks to  zachwhalen   GalaxyKate and  v   ,1
3731933332,3731933332,vitamin_A_paper,,94050064.2762661,0.7135135135135136,0.017454533525653997,2.0238072293166187,0.416403785488959,2.6525198938992043,0.676,0.033,0.0,181.03862836135988,0.06,Twitter feed of  vitaminA papers published in  PubMed    related content ranging from basic science to global health   retinoids too  Curated by  robin clugston,1
4384584201,4384584201,realNYCbot,NYC,87583638.253762,128.0,0.0019729712472018445,19.13880758348149,0.9922480620155039,23.25581395348837,0.0,0.0,0.0,3.4299876502769453,0.0,People spending money on real estate in the greatest city on earth   bot by  fitnr,1
2789766403,2789766403,Immunol_papers,,127084854.45526099,1,0.0,41.53269107183918,1.0,9.433962264150944,0.037,0.0,0.0,111.68949644640986,0.048,A TwitterBot for  Immunology papers on  PubMed searching for adaptive  innate and cyto chemokine  Curated by  ulrikstervbo  For setup see http   t co XDXfh EbYZ,1
3033516893,3033516893,ahmedmobarkqw,,113137221.432379,0.38968481375358166,0.03589269692668827,0.7965124020114014,0.2804123711340206,18.51851851851852,0.149,0.037,0.0,127.70014859507167,0.974,                    ,1
2883449266,2883449266,IMG2ASCII,Some BBS somewhere,120557082.21796489,0.9256926952141058,0.0,21.2020526125433,0.4807063440156965,25.0,0.0,1.0,0.0,111.62439575850097,0.252,Tweet me an image and I will make it look like ASCII art  instructions at http   t co xO X  ledz a bot from  muffinista  botALLY,1
2794540623,2794540623,genomeguardian,,124837785.51863503,294.0,0.0006920981467354108,4.032163802880503,0.9966101694915255,4.739336492890995,0.0,0.0,0.0,97.73270836340224,0.028,A twitterbot dedicated to supplying the most recent papers about p    the Guardian of the Genome ,1
2360867960,2360867960,IT_papers,France,143592007.0500481,1,0.0,0.12034096016205945,1.0,1.3245033112582782,0.0,0.0,0.0,170.25281657784507,0.04455445544554455,Tweetbot about ice templating or freeze casting scientific papers  Maintained by  DevilleSy,1
3401604683,3401604683,the_ephemerides,The Outer Planets,98293797.56652403,1,0.0,5.219487014455604,1.0,5.58659217877095,0.0,0.0,0.0,26.728142695781965,0.104,Random raw images from outer planet probes  accompanied by computer generated text  Images from NASA s OPUS database  Bot by  aparrish ,1
1378013310,1378013310,Dentagama,New York City,170081065.557837,0.9154030469923468,0.6019717695452922,1.8267430238690894,0.4779166705564943,1.763668430335097,0.226,0.234,0.0,133.0088398339386,0.271,Dental network featuring dentist reviews  Register at https   t co g PCmlvzMN,1
2781522928,2781522928,NRPS_papers,Newcastle,125429936.93938088,110.5,0.0006888307696571378,0.7590915081621659,0.9910313901345291,1.6778523489932886,0.0,0.011,0.0,190.50459393163445,0.086,Twitterbot of nonribosomal or nrps or non ribosomal in  Pubmed created and curated by jem stach ncl ac uk,1
2833137944,2833137944,spellwithout,,125168079.8344791,1,0.0013805436675908814,1.6614843039456257,1.0,10.416666666666666,0.0,0.0,0.0,10.70087586512651,0.025,I slice up words for your amusement ,1
1915192916,1915192916,EdTaters,,156521265.33965707,24.5,0.002208006683628802,10.21975893517591,0.9607843137254902,52.63157894736842,1.0,0.2,0.0,274.7389387207473,0.008,who are us to defy all who claim to know what republicans truly want and need   tcot,1
2300333096,2300333096,ghost_things,,146750921.99277806,2850.6,0.11598427981827351,15.92870401260604,0.9996493196801796,10.638297872340425,0.0,0.102,0.0,305.3272300715397,0.183,ghost words  ghost ideas  ghost things ,1
2429577848,2429577848,wadinfo_txt,E1M1,140179447.17757797,70.9,0.00616352837306808,1.0971080504061181,0.9860917941585535,1.3054830287206267,0.001,0.01,0.0,35.621307289302024,0.886,I am a bot   vectorpoem created me to post random places from the worlds of Doom every day ,1
2273662856,2273662856,amiibo_oracle,,148212997.773175,12.5,0.0005829448246652865,8.073202876789553,0.9259259259259259,22.727272727272727,0.0,0.0,0.0,1.2999942762061787,0.001,A bot with all the latest news about Nintendo s Amiibo    Except it s all not true     botALLY  by  ckolderup ,1
2661230324,2661230324,PROGRAMR_BAT,A:\GARBAGE.DAT,131100375.64905,200.8,0.0,23.296299380375814,0.9950445986124876,22.727272727272727,0.023,0.003,0.0,1.2999942762061787,0.413,code minus context    a bot by  inky    task will complete in         see also   rustminus,1
4638992359,4638992359,ebooks_goetia,,86018378.51552701,1272.0,0.0,3.920315702523144,0.9992144540455616,4.032258064516129,0.0,0.015,0.0,42.52885392525305,0.01,The Lesser Bot of Solomon offers you endless pages from a text in the style of Ars Goetia and the Pseudomonarchia Daemonum  From  xxvi xxxviii and  digitalsqand,1
2372788392,2372788392,SRMicro_papers,,142942294.7503419,153.42857142857142,0.007857716304063416,2.090756976596566,0.9935245143385754,3.4722222222222223,0.026,0.07,0.0,168.63461059358568,0.044,Twitterbot for anything related to super resolution microscopy,1
2649864229,2649864229,BenghaziWord,,131440536.66421294,235.0,0.013146629219983086,71.8989152040875,0.9957627118644068,66.66666666666667,0.0,0.0,0.0,11.282727523733607,1.0,Learn new words and never forget  benghazi  tcot,1
3296811423,3296811423,manygardens,"Garden City, NY",104429692.57286,1,0.0,7.850732677662491,1.0,7.874015748031496,0.0,0.0,0.0,7.551902779088629,0.004,With Silver Bells  And Cockle Shells  bot  botALLY by  BooDooPerson   http   t co XpDujaprri,1
3004140602,3004140602,viralhulk,,114248423.4375639,1,0.0,1.8959106260085354,1.0,4.166666666666667,0.002,0.0,0.0,81.47775895388429,0.06,Tweets BuzzFeed titles in Hulk talk   Not affiliated with BuzzFeed   Bot by  undoingsarah,1
2427853874,2427853874,sailorclones,At sea,140275255.34717393,103.0,0.0,10.109905674312296,0.9903846153846154,22.727272727272727,0.0,0.0,0.0,1.2999942762061787,0.014,A bot by  ckolderup  botALLY,1
2336034588,2336034588,lava_mite,"@_knutaf's desk, near Seattle",144913964.7340629,44.0,0.0011924316632776683,1.1137311735013422,0.9777777777777777,3.8461538461538463,0.0,0.0,0.0,22.581921147627366,0.0,lava lamps are more interesting when they re not quite bubbling  by   knutaf ,1
2570281736,2570281736,WWE_Network_Bot,,134025247.40780997,35.17330210772834,0.12764162223813305,6.388527658484335,0.9723553023436489,8.333333333333334,2.523,0.003,0.0,190.17356852611343,0.002,This bot will post when anything gets added to the WWE Network   This is not an official WWE Account  Created by tgrollo gmail com,1
3887467873,3887467873,infinite_scream,the void,92128687.66917706,44595.0,0.010316004971358879,175.28955647333007,0.9999775764642569,166.66666666666666,0.0,0.367,0.0,141.15347888194188,0.756, NoraReed s true feelings  used to post less but then people apparently decided fascism was a great fucking idea,1
2360784260,2360784260,EMR_research,"Manchester, UK",143599059.3415649,2.6666666666666665,0.0024067010019749183,2.681666591450553,0.7272727272727273,3.6496350364963503,0.0,0.0,0.0,120.44543707142785,0.047,Real time feed for Electronic Medical Record research papers in  PubMed  Curated by  datajujitsu,1
3328511613,3328511613,wikishoutouts,Worldwide,102496994.67588401,1,0.0,10.341329551678957,1.0,11.627906976744185,0.0,0.0,0.0,1.2999942762061787,0.032,Shout out to all the disambiguation pages out there  from  saranrapjs,1
2820127624,2820127624,Exome_seq,Cambridge,124044940.5938921,821.0,0.0,5.332570573479487,0.9987834549878345,6.993006993006993,0.0,0.0,0.0,95.11222337106997,0.037,A PubMed RSS feed for exome  Title Abstract   using dlvr it   https   t co TtLmRH  JP brought to you by  Coregenomics,1
22195977,"""22195977""","""rrsarq""","""Brasil""",301147008.7400489,1.2433628318584071,0.04131404144458772,0.3319468468846388,0.5542406311637081,1.4450867052023122,0.123,0.3,0.0,92.9684057725845,0.502,rrs arq    arquitetura   engenharia de seguran a do trabalho  engseg  sesmt  ergonomia,1
2847866239,2847866239,theseraps,,124122187.01323009,209.0,0.008353059392109232,11.210501792493265,0.9952380952380953,15.873015873015873,0.001,0.002,0.0,171.97626186713907,0.039,Tweets randomly      times a day between  am   pm PST  Lines culled from http   t co Qo  om SU   Complaints   beaugunderson,1
4060780810,4060780810,FordPinesBot,,90881629.44771194,323.0,0.0019013743597040057,37.17091804503346,0.9969135802469136,38.46153846153846,0.0,0.003,0.0,60.30923889801467,0.064,A bot that tweets every line said by Stanford Pines on Gravity Falls  Tweets every    minutes   GravityFalls  Mod   MysteryTwinPine  Personal account  Junkenrat,1
2727019322,2727019322,untag_me,,129052370.73929405,5.5,0.0,2.5434139498536075,0.8461538461538461,500.0,0.0,4.458,0.0,34.52373443867175,0.0,The ONLY way for Twitter users remove themselves from conversations ,1
2205976656,2205976656,magicpixx,,151922729.20567393,0.9434791292190933,0.11203590199434303,149.04016613173349,0.48545884287329155,500.0,0.0,1.311,0.0,54.58781201620613,0.761,Follow me for algorithmically curated pictures  lovingly delivered to your timeline  Occasionally NSFW  follow at your own risk  Brought to you by  wm ,1
195737016,"""195737016""","""alertmessages""","""UK""",251329304.09364796,3.6658838599487615,0.06256652027389839,55.285083647956405,0.7856783344772363,62.5,0.051,0.007,0.0,125.37253118487659,0.001,The Neighbourhood Alert system is a secure community messaging system used by the Police  members of Neighbourhood Watch   other community groups,1
86391789,86391789,big_ben_clock,Up a tower.,279984506.22595406,1,0.0,23.27899099795193,1.0,23.25581395348837,0.0,0.0,0.0,101.31010191428216,0.0,The first  established November        entirely unofficial  Copyright details here  http   t co q UCMopfd   but still apparently imitated everywhere ,1
